<?xml version="1.0" encoding="UTF-8"?>
<diagrama xmlns:xsi="http://www.w3.org/2001/XMLSchema-instance" xsi:noNamespaceSchemaLocation="composicion.xsd" nombre="Principal"><entidad_nueva codigo="1" nombre="Entidad 1" tipo=""><atributo codigo="2" nombre="Atributo 1" tipo="" cardinalidad_minima="1" cardinalidad_maxima="*"><atributo codigo="5" nombre="Atributo 1_1" tipo="" cardinalidad_minima="1" cardinalidad_maxima="2"/></atributo></entidad_nueva><entidad_nueva codigo="10" nombre="Entidad 2" tipo=""><atributo codigo="11" nombre="Atributo 2" tipo="" cardinalidad_minima="1" cardinalidad_maxima="1"/></entidad_nueva><entidad_nueva codigo="24" nombre="Entidad 3" tipo=""/><entidad_nueva codigo="25" nombre="Entidad 4" tipo=""/><entidad_nueva codigo="27" nombre="Entidad 5" tipo=""/><relacion codigo="13" nombre="Relacion 1"><union_entidad_relacion  codigo="14" nombre="Union" entidad="1" cardinalidad_minima="1" cardinalidad_maxima="*"/><union_entidad_relacion  codigo="15" nombre="Union" entidad="10" cardinalidad_minima="1" cardinalidad_maxima="N"/><atributo codigo="16" nombre="Atributo R1" tipo="" cardinalidad_minima="1" cardinalidad_maxima="1"><atributo codigo="18" nombre="Atributo R1_1" tipo="" cardinalidad_minima="1" cardinalidad_maxima="1"/></atributo></relacion><jerarquia codigo="28" nombre="j2" cobertura="" interseccion=""><entidad_general>25</entidad_general><entidad_especializada>27</entidad_especializada></jerarquia></diagrama>
