<?xml version="1.0" encoding="UTF-8"?>
<diagrama xmlns:xsi="http://www.w3.org/2001/XMLSchema-instance" xsi:noNamespaceSchemaLocation="composicion.xsd" nombre="Principal" estado="sin_validar"><entidad_nueva codigo="1" nombre="TipoProd" tipo="cosa"><atributo codigo="2" nombre="ct" tipo="Caracterizacion" cardinalidad_minima="1" cardinalidad_maxima="1"/><atributo codigo="4" nombre="dt" tipo="Caracterizacion" cardinalidad_minima="1" cardinalidad_maxima="1"/><identificador><atributo>2</atributo></identificador></entidad_nueva><entidad_nueva codigo="6" nombre="SubTipoProd" tipo="cosa"><atributo codigo="7" nombre="dst" tipo="Caracterizacion" cardinalidad_minima="1" cardinalidad_maxima="1"/><atributo codigo="9" nombre="cst" tipo="Caracterizacion" cardinalidad_minima="1" cardinalidad_maxima="1"/><identificador><atributo>9</atributo><relacion>11</relacion></identificador></entidad_nueva><entidad_nueva codigo="14" nombre="Producto" tipo="cosa"><atributo codigo="15" nombre="precio" tipo="Caracterizacion" cardinalidad_minima="1" cardinalidad_maxima="1"/><atributo codigo="17" nombre="presentacion" tipo="Caracterizacion" cardinalidad_minima="1" cardinalidad_maxima="1"/><atributo codigo="19" nombre="nombre" tipo="Caracterizacion" cardinalidad_minima="1" cardinalidad_maxima="1"/><atributo codigo="21" nombre="codigo" tipo="Caracterizacion" cardinalidad_minima="1" cardinalidad_maxima="1"/><identificador><atributo>21</atributo><relacion>23</relacion></identificador><identificador><atributo>21</atributo><relacion>31</relacion></identificador></entidad_nueva><entidad_nueva codigo="26" nombre="Marca" tipo="cosa"><atributo codigo="27" nombre="nombre" tipo="Caracterizacion" cardinalidad_minima="1" cardinalidad_maxima="1"/><atributo codigo="29" nombre="codM" tipo="Caracterizacion" cardinalidad_minima="1" cardinalidad_maxima="1"/><identificador><atributo>29</atributo></identificador></entidad_nueva><entidad_nueva codigo="1" nombre="Beneficio" tipo="cosa"><atributo codigo="2" nombre="dias" tipo="Caracterizacion" cardinalidad_minima="1" cardinalidad_maxima="1"/><atributo codigo="4" nombre="desde" tipo="Caracterizacion" cardinalidad_minima="1" cardinalidad_maxima="1"/><atributo codigo="6" nombre="hasta" tipo="Caracterizacion" cardinalidad_minima="1" cardinalidad_maxima="1"/></entidad_nueva><relacion codigo="11" nombre="TP/STP" tipo="asociacion"><union_entidad_relacion  codigo="12" nombre="Union" entidad="1" cardinalidad_minima="0" cardinalidad_maxima="n"/><union_entidad_relacion  codigo="13" nombre="Union" entidad="6" cardinalidad_minima="1" cardinalidad_maxima=""/></relacion><relacion codigo="23" nombre="STP/P" tipo="asociacion"><union_entidad_relacion  codigo="24" nombre="Union" entidad="6" cardinalidad_minima="1" cardinalidad_maxima="n"/><union_entidad_relacion  codigo="25" nombre="Union" entidad="14" cardinalidad_minima="1" cardinalidad_maxima=""/></relacion><relacion codigo="31" nombre="M/P" tipo="asociacion"><union_entidad_relacion  codigo="32" nombre="Union" entidad="14" cardinalidad_minima="1" cardinalidad_maxima=""/><union_entidad_relacion  codigo="33" nombre="Union" entidad="26" cardinalidad_minima="1" cardinalidad_maxima="n"/></relacion></diagrama>
