<?xml version="1.0" encoding="UTF-8"?>
<diagrama xmlns:xsi="http://www.w3.org/2001/XMLSchema-instance" xsi:noNamespaceSchemaLocation="composicion.xsd" nombre="Principal"><entidad_nueva codigo="1" nombre="EntidadA" tipo="cosa"><atributo codigo="2" nombre="atributoA" tipo="caracterizacion"/><identificador><atributo>2</atributo><relacion>5</relacion></identificador><relacion>5</relacion></entidad_nueva><entidad_nueva codigo="3" nombre="entidadB" tipo="cosa"><atributo codigo="4" nombre="atributoB" tipo="caracterizacion"/><identificador><atributo>4</atributo></identificador><relacion>5</relacion></entidad_nueva><relacion codigo="5" nombre="Relacion" tipo="asociacion"><entidad_relacion entidad="1" cardinalidad_minima="1" cardinalidad_maxima="n"/><entidad_relacion entidad="3" cardinalidad_minima="1" cardinalidad_maxima="1"/></relacion></diagrama>
