<?xml version="1.0" encoding="UTF-8"?>
<diagrama xmlns:xsi="http://www.w3.org/2001/XMLSchema-instance" xsi:noNamespaceSchemaLocation="composicion.xsd" nombre="DiagramaHijo" estado="sin_validar"><diagrama_ancestro>Principal</diagrama_ancestro><entidad_nueva codigo="3" nombre="Entidad 2" tipo=""/><entidad_nueva codigo="6" nombre="Entidad 3" tipo=""/><entidad_nueva codigo="1" nombre="Entidad 4" tipo=""/><entidad_global codigo="2" nombre="Entidad Padre" diagrama_ancestro="Principal" codigo_entidad_nueva="1"/><relacion codigo="5" nombre="Relacion"><union_entidad_relacion  codigo="7" nombre="Union" entidad="2" cardinalidad_minima="" cardinalidad_maxima=""/><union_entidad_relacion  codigo="8" nombre="Union" entidad="6" cardinalidad_minima="" cardinalidad_maxima=""/></relacion><jerarquia codigo="4" nombre="j1" cobertura="parcial" interseccion="exclusiva"><entidad_general>2</entidad_general><entidad_especializada>3</entidad_especializada><entidad_especializada>1</entidad_especializada></jerarquia></diagrama>
