<?xml version="1.0" encoding="UTF-8"?>
<diagrama xmlns:xsi="http://www.w3.org/2001/XMLSchema-instance" xsi:noNamespaceSchemaLocation="composicion.xsd" nombre="Principal"><entidad_nueva codigo="1" nombre="EntidadNuevaPapa" tipo="cosa"><atributo codigo="2" nombre="idPapa" tipo="caracterizacion"/><identificador><atributo>2</atributo></identificador><jerarquia>7</jerarquia></entidad_nueva><entidad_nueva codigo="3" nombre="EntidadNuevaA" tipo="cosa"><atributo codigo="4" nombre="idA" tipo="caracterizacion"/><identificador><atributo>4</atributo></identificador><jerarquia>7</jerarquia></entidad_nueva><entidad_nueva codigo="5" nombre="entidadNuevaB" tipo="cosa"><atributo codigo="6" nombre="idB" tipo="caracterizacion"/><identificador><atributo>6</atributo></identificador><jerarquia>7</jerarquia></entidad_nueva><jerarquia codigo="7" cobertura="total" interseccion="exclusiva"><entidad_general>1</entidad_general><entidad_especializada>3</entidad_especializada><entidad_especializada>5</entidad_especializada></jerarquia></diagrama>
