<?xml version="1.0" encoding="UTF-8"?>
<diagrama xmlns:xsi="http://www.w3.org/2001/XMLSchema-instance" xsi:noNamespaceSchemaLocation="composicion.xsd" nombre="Principal"><entidad_nueva codigo="1" nombre="Entidad 1" tipo=""><atributo codigo="11" nombre="Atributo 1" tipo="Copiado" cardinalidad_minima="1" cardinalidad_maxima="1"/><atributo codigo="13" nombre="Atributo 2" tipo="" cardinalidad_minima="1" cardinalidad_maxima="1"/><identificador><atributo>11</atributo></identificador></entidad_nueva><entidad_nueva codigo="2" nombre="Entidad 2" tipo=""><atributo codigo="27" nombre="Atributo 1A" tipo="" cardinalidad_minima="1" cardinalidad_maxima="1"/><identificador><atributo>27</atributo><relacion>3</relacion></identificador></entidad_nueva><entidad_nueva codigo="6" nombre="Entidad 3" tipo=""/><entidad_nueva codigo="8" nombre="Entidad 4" tipo=""><atributo codigo="21" nombre="Atributo 4" tipo="" cardinalidad_minima="1" cardinalidad_maxima="1"><atributo codigo="23" nombre="Atributo 4 4" tipo="" cardinalidad_minima="1" cardinalidad_maxima="1"/><atributo codigo="25" nombre="Atributo 4 1" tipo="" cardinalidad_minima="1" cardinalidad_maxima="1"/></atributo><identificador><atributo>21</atributo></identificador></entidad_nueva><entidad_nueva codigo="9" nombre="Entidad 5" tipo=""><atributo codigo="15" nombre="Atributo 1" tipo="" cardinalidad_minima="1" cardinalidad_maxima="1"><atributo codigo="17" nombre="Atributo 1:1" tipo="" expresion="ewga" cardinalidad_minima="1" cardinalidad_maxima="1"/></atributo><atributo codigo="19" nombre="Atributo 4" tipo="" cardinalidad_minima="1" cardinalidad_maxima="1"/><identificador><atributo>15</atributo><atributo>19</atributo></identificador></entidad_nueva><relacion codigo="3" nombre="Relacion 1"><union_entidad_relacion  codigo="4" nombre="Union" entidad="1" cardinalidad_minima="" cardinalidad_maxima=""/><union_entidad_relacion  codigo="5" nombre="Union" entidad="2" cardinalidad_minima="" cardinalidad_maxima=""/></relacion><jerarquia codigo="7" nombre="J1" cobertura="parcial" interseccion="exclusiva"><entidad_general>1</entidad_general><entidad_especializada>6</entidad_especializada></jerarquia><jerarquia codigo="10" nombre="J2" cobertura="total" interseccion="exclusiva"><entidad_general>6</entidad_general><entidad_especializada>8</entidad_especializada><entidad_especializada>9</entidad_especializada></jerarquia></diagrama>
