<?xml version="1.0" encoding="UTF-8"?>
<diagrama xmlns:xsi="http://www.w3.org/2001/XMLSchema-instance" xsi:noNamespaceSchemaLocation="composicion.xsd" nombre="Principal"><entidad_nueva codigo="1" nombre="Entidad 1" tipo=""/><entidad_nueva codigo="2" nombre="Entidad 2" tipo=""/><entidad_nueva codigo="3" nombre="Entidad 3" tipo=""/><jerarquia codigo="4" nombre="JERARQUIA" cobertura="" interseccion=""><entidad_general>1</entidad_general><entidad_especializada>2</entidad_especializada><entidad_especializada>2</entidad_especializada><entidad_especializada>3</entidad_especializada><entidad_especializada>3</entidad_especializada></jerarquia></diagrama>
